,Tweets,Subjectivity,Polarity,country,region
193,"    HRC  50M Nigerians need UAAG disbursement now, many lives have lost because of this grant, APC government must rise to the yearning of her citizen and disburse this ready grant now...Save our soul...",0.5,0.35,Nigeria,ex-British Colony
194,"First of all this is very unfair. 

You're putting our Government, as in, Ijoba, a WHOLE DEPUTY KING PIN beside someone who lost someone on the staircase!!!

Even Baido did a better job than Blade!!! https//t.co/dIjZWyGEDp",0.5583333333333333,0.241796875,Nigeria,ex-British Colony
195,Federal government…..  landlord and landlady done kill us with house rent for Lagos …. Kindly come to our rescue 🙏🙏🙏🙏🙏🙏,0.9,0.6,Nigeria,ex-British Colony
196," let the world know it that the Nigerian government is not will to allow UAAG to disburse the grant money given to the less privileged in Nig. Pls. UN, US etc come to our aid before it's too late",0.3333333333333333,-0.23333333333333334,Nigeria,ex-British Colony
197," Job well done.... The question I have for you is, after paying our taxes to fund infrastructure, why do we have to pay for toll to use it?

Please enlighten me if I am wrong. We need to know the usefulness of taxes being paid. Is it only for government workers salaries?",0.95,-0.25,Nigeria,ex-British Colony
198,"Olanrewaju0   Nigeria government please give us our grant money , we are the subscribe of this money 
Our Father president Buhari help us Nigeria cabal doesn't want to give us our grant",0.0,0.0,Nigeria,ex-British Colony
199,"    It’s sad the responses from our youths. Despite this government’s abysmal failure and the standard of living in this country, they still have some misguided youths supporting them. Its true, the people deserve the kind of government they get. Oby may not be the best, but...",0.4857142857142857,0.1976190476190476,Nigeria,ex-British Colony
200,"That road became a River, a big one that people coudn't risk it to get to their house(s).

Then, our cries were finally heard. This is the same Mowe that has people representing it at all levels in government.",0.4083333333333334,0.0,Nigeria,ex-British Colony
201,     Like many others declarations that still made us borrow billion and squander our reserves. Guy this government is the most corrupt in the world as we speak. Keep quiet there!,0.5833333333333334,0.125,Nigeria,ex-British Colony
202,  This is true but the fault start from our government,0.65,0.35,Nigeria,ex-British Colony
203, Again I say you need to touch sand. Uber is a luxurious way of transportation. The government has provided buses and the likes for regular people. Going outside of this to use e-hailing apps is a luxurious means of transportation in this country considering our economy.,0.06346153846153846,0.0,Nigeria,ex-British Colony
204,"Our f00lish government will affect everything and every hustle in our lives. This is why Nigeria is one of the most difficult and dangerous place to hustle for money or chase a dream to become successful. Our Government is a threat and bad luck to us!

Really sad to know 😔",0.8361111111111111,-0.2041666666666666,Nigeria,ex-British Colony
205," Now, this is the state of our nation. To win election you need “godfathers”. To get a contract in government or get employment you need “godfather’s”backing. The nation has been divided into principalities and fiefdoms. Well, there is hope. Use your PVC to Vote . ObiDatti2023",0.4,0.8,Nigeria,ex-British Colony
206, Now how do our tax paid in Akwa Ibom to FIRS work for us. Point out one federal government presence   group lead. Or is it that all taxes are used in development of Lagos and other none South South State?,0.375,-0.125,Nigeria,ex-British Colony
207," Wishful thinking and big grammar, affliction will not come upon Nigerians second time. APC government didn't do the will of the people. Common Rice is 53k against initial 8k, my brother our mumu no too much!",0.16,-0.009999999999999998,Nigeria,ex-British Colony
208,"am Simple, really.
Here, most of our religious activities are all about getting stuff from God, not about loving God.
So, when we go to the abroad, we realize that all those things we based our religion on, oyibo government has done it.",0.4514285714285714,0.25999999999999995,Nigeria,ex-British Colony
209,"  Until when IBB came with his SAP and messed things up. That was the beginning of our woes. Another military government came in and things got messier. We chop sanctions join again. Now, we are gradually laying foundation for industrialisation and infrastructure",0.1,-0.1,Nigeria,ex-British Colony
210,What’s really going on in this country? Terrorist are given uniforms by our government to disguise as policemen and they’re taking us out one after the other like broomstick but still we ain’t still awakened. God save us from animals in human skin https//t.co/louBnZ9p84,0.22499999999999998,0.025000000000000005,Nigeria,ex-British Colony
211, This is what most of us ask for our government,0.5,0.5,Nigeria,ex-British Colony
212,"olu For the very first time I share the same view with you on governance in our dear country.
People's sense stop working as soon as they step into naija. Who runs compationate  government any where in the aside naija.",0.2791666666666667,0.1625,Nigeria,ex-British Colony
213, Eti-Osa local government secretariat Lagos don't want to give us our PVC peterobi Pele BurnaBoy Inec Rinu Arisetv  Channeltv https//t.co/TMxI8IpGNd,0.0,0.0,Nigeria,ex-British Colony
214,Securing Multiple Data Centers Our Results Using MACsec Over the Equinix Fabric https//t.co/QFPSuU9dCY https//t.co/GWbXbQetKT,0.0,0.0,Nigeria,ex-British Colony
215,"my brother, this PDAPC government just dont want to accept their fault that they dont understand the government anymore...our incoming PRESIDENT will clear their mess https//t.co/iQ8eRdYIkf",0.2791666666666667,-0.037499999999999985,Nigeria,ex-British Colony
216,olu It's actually the fault of successive government. They all failed to let Nigerians know how much their lives were being subsidised. Our citizens have now become so entitled.,0.20000000000000004,-0.09999999999999999,Nigeria,ex-British Colony
217,"  Thank you so much David, you are one of a kind.
You have been the fourth arm of our government long before some of us understood what you were doing.

May God bless you and keep you heart and healthy, through Christ our Lord. Amen 🙏

Ọ ya abalụ gị Bro 🙌",0.4,0.25,Nigeria,ex-British Colony
218,"  Which economy did you diversify in covid? How was the economy pre-Covid. Where was inflation? Was our economy not diversified before Covid. 

Instead of you to call a government that killed education, you are here praising mediocre.",0.5,-0.35,Nigeria,ex-British Colony
219,"Frame 1 I collected my PVC today and my wife's will be ready by first week of January.
Frame 2 Let's choke those con men and enemies of democracy in government to death with our right votes. https//t.co/zhy4fLiCzp",0.45634920634920634,0.24523809523809526,Nigeria,ex-British Colony
220,"szn  The  are better that we Yoruba, because they lift there family member up,that why dey are everywhere in the government sector,but we Yoruba worst hypocrisy has eaten deep in our system because of peanut,to say the truth is a problem for us.",0.6333333333333333,-0.16666666666666666,Nigeria,ex-British Colony
221,"Nigerians, our vote does count! 🗳️Are you anticipating what the new government will have in store for us? It's almost time to determine who our next leaders will be, as the 2023 general election is just around the corner. https//t.co/oKX13bpXjZ",0.3181818181818182,0.062121212121212126,Nigeria,ex-British Colony
222,"To all the punters out here,big kudos to you guys...Una don help pass our government",0.0,0.0,Nigeria,ex-British Colony
223," If government can solve the security issues and also the electricity issues , with better infrastructure, Naija go make sense as investors go come back. We also have our impact too, if we can replicate our behaviours in other countries here in Naija, go go make sense small.ire oo",0.2916666666666667,0.125,Nigeria,ex-British Colony
224,"JAGs   omo       shina   Remember that it's a concession. While you need a contractor to execute the EPC, you also need same contractor to be able to raise capital, pay for the concession to our government, fund the full project, then operate, manage and maintain it. 
Chinese will fund the project.",0.325,0.2125,Nigeria,ex-British Colony
225,"An APC chieftain said Tinubu has struck a deal with the G5 Governors ahead of the 2023 presidential election.

“We have agreed to work together with the G5. The agreement rhythm with our desire to forge together a government of national unity.""

https//t.co/XaWSsc48Pu",0.0,0.0,Nigeria,ex-British Colony
226,"Eti Osa Local Government.

Na here we dey 😍

We go collect our card https//t.co/KZ30MFbl6v",0.0,0.0,Nigeria,ex-British Colony
227,"   You can't blame importers u knw if government are productive no one will import goods .like example aba guys are very very productive in so many aspect like shoe..cloths, bags, electronic, textiles.but our government are not supportive .if not those guys go dey compete with China",0.63,0.17,Nigeria,ex-British Colony
228, We are our own problem. We just sugar everything and blame the government to suit our agenda. When did currency become cloth that we wash? I can’t wait till when they start prosecuting people who tries to sabotage the new note. Currently is not a private property,0.5573863636363636,0.1590909090909091,Nigeria,ex-British Colony
229,   I was born and brought up in lagos state bro listen let's not decive our selvs here even a child knws ..igbos contribute economically than any tribe in nigeria especially lagos ..75% of importers in lagos port are igbos..the money goes to lagos government and federal governments,0.95,0.15,Nigeria,ex-British Colony
230," Don't blame humanity, blame our government who failed to manage the demographics of haridwar and shamed devbhumi",0.3,-0.5,Nigeria,ex-British Colony
231,"Leadership? We export what we don't have and import what we have. We export electricity and import Fuel. What is our problem.
All this is happening because we don't have the right people in government. 
Our leaders are not wise. The looters are not intelligent. A rat when ...3",0.7785714285714286,-0.15476190476190477,Nigeria,ex-British Colony
232,"IK Honestly you want make my family disown me, my uncle na the present chairman of our local government, my papa teach femi gbajabiamila for school, infact na my uncle because e get where we Dey see. Abeg na awa lokan I no want hear anything",0.3,0.19999999999999998,Nigeria,ex-British Colony
233," Tinubu was 69. In 2012,
In 2022 he is now officially 72, that's a miracle,. Tinubu is not a honest man, but atiku is worse in the sense that atiku's cronies are the catel of the cabals that has held our economy down and government ungovernable.",0.5962962962962963,-0.28518518518518515,Nigeria,ex-British Colony
234,That they could not even finish their Party Office and no tangible projects. Ohhh I remember again  since 1999 no government has ever equipped our military the way this same Buhari has done. So what are we now talking? Our Agricultural system is that what we want to talk?,0.1125,-0.05,Nigeria,ex-British Colony
235," What is the federal government producing to increase production. PMB government have tried to bring in more investors and reduced importation of rice,  some other items that can sourced locally even exportation of our farm produced need to granted  by government before export.",0.2916666666666667,0.125,Nigeria,ex-British Colony
236," 97% of Nigerian masses are dieing of hunger,united nation gave the masses grant to eradicate poverty and invest it in our various life's,Nigerian government has not disburse this grant up till now being 29th December,and election is next year!!!",0.25,0.0,Nigeria,ex-British Colony
237," 97% of Nigerian families are dieing of hunger,united nations can to eradicate poverty by giving us grants,Nigerian government has not disburse the grant meant for poor masses,UN come for our rescue..",0.6,-0.4,Nigeria,ex-British Colony
238," In our clime accountability is seen as witch-hunt and also strange, reason is why someone can be poor and after taking political appointment he'll become rich suddenly and all kinds of chieftaincy titles will be given to them even government will recognise them",0.42000000000000004,-0.015000000000000003,Nigeria,ex-British Colony
239,  They know all our 'government names'.,0.0,0.0,Nigeria,ex-British Colony
240,"CONCH2  Bro are you sure you stay in 9ja?  cus currently private hospitals are more equipped than our government hospitals. 
* Na only for 9ja person dey dey operation room and power will go off. 
*Only in our government hospitals u hear words like ""no cotton wool, manage d fabric""",0.7527777777777778,0.2,Nigeria,ex-British Colony
241,"        United Alliance for African Grant that is meant for poor masses in Nigeria has been hijacked by cabals in Nigerian government please come to our aid.
BATKSM2023",0.3,-0.2,Nigeria,ex-British Colony
242,"      I will never forget how you rescued this country from our corrupt leaders on floating of NigeriaAir. 

You don't just talk, you enlighten us more. 

No to bad government.

DeltaPDPRally 
ASUU 
",0.7222222222222222,-0.23333333333333328,Nigeria,ex-British Colony
243,"  We have to give out all our energy and everything we possess in this coming elections. We rather die making sure we elect Peter Obi, than dying under another nonsense government lead by PDAPC.",0.8944444444444444,0.65,Nigeria,ex-British Colony
244," This is what I experience at Eti-Osa local government secretariat Lagos,the INEC officials refused to give us our PVC https//t.co/r0SfaSzb8R",0.0,0.0,Nigeria,ex-British Colony
245, Please tell the INEC officials at Eti -Osa local government secretariat to give us our PVC,0.0,0.0,Nigeria,ex-British Colony
246, Our Government have no value for life.. If one die or any tragic happen e no concern them as far as its not their family,0.875,-0.325,Nigeria,ex-British Colony
247," Let me report this again,  Ibeju-lekki town like Magbon, Orimedu, AKODO and others are not having light for the past few years. But we leant that our local government secretariat is having light 🕯️.",0.35,0.07,Nigeria,ex-British Colony
248,"How can Nigerian government at all levels  get just 50% of our able body men off okada to Agricultural ventures?
How can they get 50% of young graduates to Agricultural ventures? https//t.co/41U0qCojMo",0.5125,0.3,Nigeria,ex-British Colony
249,"  Boss, our government has not been Faithful in the little they have. All Nigerians are asking for is the judicious use of their money. for example Lagos with the highest tax rate in Nigeria, are the amenities commensurate.",0.5,-0.1875,Nigeria,ex-British Colony
250, We’re loosing our citizens to other nations of the world because of bad government 🥲 see as them dey happy up and down. How many foreigners be citizen of Nigeria 😌,0.566111111111111,0.06388888888888893,Nigeria,ex-British Colony
251,"  I thought government is serve and comot. If you stay there for the rest of your life how will others get a chance to serve? 

Also, where were all these geniuses when APC ruined our economy and the country?",0.0,0.0,Nigeria,ex-British Colony
252,"  Whose fault? The farms are nowhere to go.Bandits are all over.Our tertiary institutions &amp; research institutes that should be well funded for agricultural productivity, they're underfunded.Nimet said there would be flood across Nigeria, what did the government do,nothing?",0.0,0.0,Nigeria,ex-British Colony
253, Please make your outreach down to eti osa local government area at lekki epe expressway.  officials is making it extremely difficult for us to get our pvc. They keep coming out to call exactly the same names as before. The crowd don dey vex.,0.3327777777777778,-0.0811111111111111,Nigeria,ex-British Colony
254,"33  For us , unfortunately the answer is yes. We have been living for far too long without consequences for our actions. A popular face on TV blamed Google maps and threatened to call the governor and people were backing him bcos he's against the government of the same Gov 🤡.",0.6849999999999999,0.029999999999999992,Nigeria,ex-British Colony
255, Why would our government believe there is SAPA....,0.0,0.0,Nigeria,ex-British Colony
256,"  All he does is to collect millions of dollars from the government in the name of turn around maintenance of our refineries, right from the time of the Abacha government,till today one cup we never refine,that man is a yahoo man.",0.5357142857142857,0.2857142857142857,Nigeria,ex-British Colony
257,Does each leader in all arms of government &amp; at all levels in Nigeria think they can live forever? All the wealth you have stolen &amp; the duniya will make no sense to you at appropriate time. You will be forgotten soon by your sons &amp; daughters you stole our resources for. Orun a da,0.5,0.3181818181818182,Nigeria,ex-British Colony
258,"on and support the government, the betterment of the people and our country is our priority not any political post. Iree oh",0.1,0.0,Nigeria,ex-British Colony
259,"  We need not an old wag, we have had enough of these people, he is part of the current government and the land is bleeding now and we can't stand another failure....if he ain't backing down peacefully, we would forcefully send him home come February with our votes. 👎👎👎",0.3777777777777778,0.03888888888888888,Nigeria,ex-British Colony
260," UN how can we Nigerian masses being slaves in our country,our right is being denied,97% of our various homes are dieing of hunger,UN gave a grant to stop poverty in our various homes,Nigerian government refused to disbursed the grant,today is 29th December!!!",0.5119047619047619,0.09523809523809523,Nigeria,ex-British Colony
261," 97% of Nigerian families ate poor,the grant united nation gave the masses to eradicate poverty the Nigerian government has not disburse the grant up till now 29th December 2022,Pls United Nation Come for our Rescue!!!0",0.0,0.0,Nigeria,ex-British Colony
262, Our mindset of compensation in any case like this should stop. because this is a serious issues  that government should take a serious about. all our mindset will be going after the compensation how many days now that the badly incident happened that will have been asked money https//t.co/0RwcRZ0fjO,0.625,-0.21666666666666662,Nigeria,ex-British Colony
263,@dinomelaye You'll never smell that government house again. People like you are our problems. Political jobbers with no side hustling.,0.1,0.0,Nigeria,ex-British Colony
264,I hope our government is aware of the coronavirus surge in China again.,0.25,0.25,Nigeria,ex-British Colony
265,"We call on all relevant international bodies to please come to our aid. The APC led government is trying to hijack the United Alliance for Africa Grant meant for the poor Nigerians. Please help us!
     ",0.5,-0.033333333333333326,Nigeria,ex-British Colony
266, That tells you that sometimes our people are the corrupt ones...cheating fellows and blaming Government.,1.0,-0.5,Nigeria,ex-British Colony
267,"PR Make this moneybsha no reach our government hand else it’s gone!

Well I teaching DEEPFAKE VIDEO CALL to use on any Social App to convince a client/whitehead. 
You need just your smartphone or laptop and it works perfectly on both + very affordable!

check my pinned tweet &amp; DM",0.45555555555555555,0.4277777777777778,Nigeria,ex-British Colony
268, Nigerian government please release our UAAG grant. The world is watching us.,0.0,0.0,Nigeria,ex-British Colony
269,     The police man shouldn’t go unpunished because this our government can’t be trusted.. simple English,0.17857142857142858,0.0,Nigeria,ex-British Colony
270," u changed the system of our government 4rm managing 2 worse, but nevadless. Killings everywhere,kidnappin is now a day 2 day job 2 some pple &amp; u made some pple understand dat education can neva b d key .Youths are fallen out flyn out, etc .Tnks anyway 4 mkn us understand hardshp",0.8,-0.2,Nigeria,ex-British Colony
271, PR Is funny how we blame our government on every bad situation in this country,0.8333333333333333,-0.22499999999999992,Nigeria,ex-British Colony
272," 97% of Nigerian families are dieing of poverty,united nation(UN)came to rescue our various homes by giving us grants,today is 29th December 2022,Nigerian government has not disburse the grants meant for the poor masses to eradicate poverty in our various homes,come for our rescue",0.5333333333333333,-0.13333333333333333,Nigeria,ex-British Colony
273,"We have to create a conducive environment for investment, for both foreign and local investors to come and invest in our country because government alone cannot drive the Economy forward.  
Atiku will RecoverNigeria with his NigeriaRecoveryPlan https//t.co/3rAaLWpG2q",0.0625,-0.0625,Nigeria,ex-British Colony
274,"  United nation (UN) 97% of Nigerian families are poor,united nation gave our masses grant to eradicate poverty and to invest in our various life's, today is 29th December Nigerian government has not disburse the grant meant for the poor masses!!!",0.55,-0.390625,Nigeria,ex-British Colony
275," UN come for our rescue in Nigeria,The grant united nation gave Nigerian masses to eradicate poverty in some of our homes,today is 29th December 2022,Nigerian government has not disburse the grant and next year is General Election...",0.25,0.02500000000000001,Nigeria,ex-British Colony
276, Nigerian spending dollars more than the owner of the currency 😔 we need to change ourselves before we can change our government,0.5,0.5,Nigeria,ex-British Colony
277," Which peace are you talking about Mr President???,Even today the grant united nation(UN) gave poor Nigerian masses to Eradicate poverty in our families,federal government has not disburse the grant cos the federal government cabals wanted to hijacked the money by all means!!!",0.6,-0.78125,Nigeria,ex-British Colony
278,  It's a good move. The issue is our revenue is too low to carry loads of government expenditure,0.45000000000000007,0.35,Nigeria,ex-British Colony
279," You as a governor what have you done to change the narrative?, we can blame buhari all we want but we still need to blame our governors, ministers and local government chairmen for the problems we are facing as a country.",0.0,0.0,Nigeria,ex-British Colony
280," Going through some comments and I just Dey laugh, our university education is heavily subsidized by government, yet they run their mouths, say and wish evil things on the country. I know they will find it difficult to understand your tweet, cos their heart is filled with hate ☹️",0.7333333333333334,-0.3,Nigeria,ex-British Colony
281, Please add a P2P option for Nigerians. Get a merchant in Nigeria whom we can transfer cash to in order for the merchant to fund our accounts for us. The Nigerian government has restricted making payment and chopping online via bank cards.,0.0,0.0,Nigeria,ex-British Colony
282,"  Diversification of the economy is ongoing and most of our dead factories are being raised, our refineries are getting back on and dangote Refinery which the government has a stake is a game changer for our local consumption. Importation of refined crude suck off most of our FX",0.39999999999999997,-0.042857142857142864,Nigeria,ex-British Colony
283," Our government will explain why they always need to increase and increase. All the while taking more loans and mortgaging the future of Nigeria and generations unborn. 

I blame us, the 30-50 band. People who should have been retired, we continue to recycle.",0.3125,0.25,Nigeria,ex-British Colony
284,‘WOMAN KING’ is a must see by all. It’s a story based on Oyo kingdom but was shot in South Africa because of the insecurity in Nigeria. What a loss to the Nigerian youth. Our government must wake up. Vote wisely guys.,0.9,0.7,Nigeria,ex-British Colony
285," UN how can we be slave to Nigerian government, UN gave we Nigerians grant,up till now Nigerian government has not disburse the grant,grant meant to uplift the masses are still with Nigerian government, UN come for our rescue...",0.0,0.0,Nigeria,ex-British Colony
286, At this point are we sure it’s not our government that is  requesting for the deportations???,0.8888888888888888,0.5,Nigeria,ex-British Colony
287,"My dad fueling his car at 270/liter today in Port Harcourt Dey vex me. Coupled with our Estate and it’s enviro never see light since March 2021 bcos of community and government feud 🥹. I wish I fit waybill Fuel from Lagos to Ph,",0.55,0.4,Nigeria,ex-British Colony
288,"  What has Biafra got to do with this ehhh
We should be looking for a way forward
Or do you like the way the country is be ruined by our so called government

Let's put aside all this petty grievances that has splitted us for so long",0.4,-0.05,Nigeria,ex-British Colony
289,"      What is this one saying?🤣🤣🤣 You are cool with Sheikh Gumi, but can't deal with Nyesom Enwo Wike. Stop smoking salt dude. It will ruin you. Gumi and his boys versus ESN/IPOB gang as faces of our government house! Aye ooo! No wonder your name is ""Suffer No Dey Do You"" I see!",0.65,0.68359375,Nigeria,ex-British Colony
290,Please tell Tinubu not to try to compromise our security institutions. The hatchet plan against Emefiele will not work. The new policies remain until there’s a change of government. https//t.co/lp1F339xYP,0.45454545454545453,0.13636363636363635,Nigeria,ex-British Colony
