,Tweets,Subjectivity,Polarity,country,region
159,   Why would you think Kenyans want Lesbians Gays and Bisexuals to be in government and begin to entrench that kind of immorality in our nation through policies. As a Muslim I am shocked you would even say this in public,0.5888888888888889,-0.033333333333333326,Kenya,ex-British Colony
0, Our government blocked it for us too.,0.0,0.0,Botswana,ex-British Colony
1," 100k that would not have been necessary if this “government” didn’t support criminals and ignore victims. Cos the scum that did it are gonna get a cuddle, food, shelter, educational opportunities, free entertainment, etc etc all on our tax $, no justice! https//t.co/ugvZZd71Uf",0.6125,0.1125,Botswana,ex-British Colony
2,"Wow, my best manager was female.
Helen Clark I would rate in our top 3 PM’s even though her government wouldn’t rate.
Dame Valerie Adams is a pretty powerful woman I don’t think many kiwi blokes would not stand if she commanded https//t.co/D5zcRCQiv9",0.6380952380952382,0.37857142857142856,Botswana,ex-British Colony
3,"  Exactly what our government manipulated media does, alienates under the guise of equality, to the point of even handing tax payer mo way over to a known street gang. https//t.co/cQlASF0fev",0.25,0.25,Botswana,ex-British Colony
4, I’m from nz- and you re right! The government here is like nazi germany- most people are in a sleep like trance whilst the government rape our pockets and beat out our free will into submission!recently gov arrested a baby whose parents refused it a blood transfusion of vax blood,0.6119047619047618,0.41904761904761906,Botswana,ex-British Colony
5,81 elect Waititi of Party into Senate to Protect Our Democracy And hereby Govern and furthermore for as such I elect  Judith Collins and her caucus of  National to run in government in coalition with The Native Party of,0.7666666666666666,0.5333333333333333,Botswana,ex-British Colony
6, grant  c  That’s a bit of a big generalisation which neither our government or courses agree with although it’s true interpretations have been expanded and that’s what I think exercises  people.,0.375,0.175,Botswana,ex-British Colony
7," Special treatment of certain groups by the government causes social divisions. Maybe stop highlighting our differences and start focusing on our common ground. All people need the same basic things, the leaders should get this right first, housing, safety, education, food, etc.",0.3535714285714286,0.1050595238095238,Botswana,ex-British Colony
8,  Compared to 2020 I think classing their current response as shit is pretty fair. Even Australia are better than us now. Some states had mask mandates re-instated in November due to the Omicron wave they were riding. But our government... &lt;crickets chirping&gt;,0.6625,0.1875,Botswana,ex-British Colony
9,Disgraceful position from our government https//t.co/2hNX8AGW2K,0.0,0.0,Botswana,ex-British Colony
10," A pointless exercise, but our government will be forced to toe the line, in fact Ardern will probably relish it. We need China for trade, will they take kindly to this, but then China needs our food.",0.5333333333333333,0.016666666666666646,Botswana,ex-British Colony
11," itmax  In New Zealand, everyone complains on why our government keeps sending money to Ukraine to support the troops. 

But the media fails to cover the ”why”. Genocide, mass grave, innocent people effected. 

They just cover, headline “ Money sent to Ukraine” 2/1",0.48484848484848486,0.04545454545454545,Botswana,ex-British Colony
12,"  By giving tax cuts to the rich and letting go the poor Starve or suffer from curable diseases by cutting government services.

We need ACTs policies like a stake driven though our collective Kiwi hearts!

No thanks!",0.6125,-0.225,Botswana,ex-British Colony
13,"Over the past few months, I have met people including some frail old people who have had Covid in 2022 and survived. They are all thankful that our government reacted the way it did in 2020 and saved them from the initial variants. churardern   ",0.1375,-0.0875,Botswana,ex-British Colony
14," How will ArtificialIntelligence disrupt government? 

Because we'll be ruled instead by our AI Overlords?",0.0,0.0,Botswana,ex-British Colony
15,faker I think you have got to use to the Adren government and the way they are in our lives at every corner.,0.0,0.0,Botswana,ex-British Colony
16," Express Not anymore. We have a corrupt government, apartheid happening, cost of living crisis, out of control crime. It is not the Country it once was.  We are looking forward to the Labour government being booted next year, along with our commie PM.",0.5,-0.25,Botswana,ex-British Colony
17,"  The media have blamed the Christchurch and Kaikoura earthquakes but the government's exposure to Christchurch was $18 billion, and Kaikoura cost $2 billion. 
Also, there has been minimal coverage of the effect of billions pumped into our economy from foreign insurance.",0.3625,-0.1125,Botswana,ex-British Colony
18,"  The media have blamed the Christchurch and Kaikoura earthquakes but the government's exposure to Christchurch was $18 billion, and Kaikoura cost $2 billion. 
Also, there has been minimal coverage of the effect of billions pumped into our economy from foreign insurance.",0.3625,-0.1125,Botswana,ex-British Colony
19,"NZ should be doing the same. Just because we have high rates of vaccination doesn’t mean all is well. Our government appears to have learned nothing even from our successes in 2020, when covid was kept out at the border. 

https//t.co/oZR12cli21",0.45083333333333336,-0.050833333333333335,Botswana,ex-British Colony
20, New Zealand if you just ignore our racist government,0.45454545454545453,0.13636363636363635,Botswana,ex-British Colony
21,"This is down to the Tory government underfunding of our NHS 13 years…of Closure of our wards , underpaying Staff.. cuts in mental health , services!! Pay .. equipment!! That’s the Tory Government for you !! https//t.co/ldXCXQJxcf",0.24444444444444446,-0.2685126410590278,Botswana,ex-British Colony
22,"   As it turned out, the government was not interested in our health at all. They knew the medication was not properly tested, and no promises were made about its ability to fight covid.",0.3,-0.0625,Botswana,ex-British Colony
23,Signed 69% of New Zealanders support the decriminalization or legalization of cannabis. Join us to call on the New Zealand Government to overturn cannabis possession and decriminalise cannabis possesion and use. https//t.co/DcYyZAEPvb via ,0.45454545454545453,0.13636363636363635,Botswana,ex-British Colony
24,"""The files show the FBI acting as doorman to a vast program of social media surveillance and censorship, encompassing agencies across the federal government – from the State Department to the Pentagon to the CIA,”

There goes our Democracy. 

US Fascism!

https//t.co/xKAEzPlKan",0.35555555555555557,0.013888888888888888,Botswana,ex-British Colony
25,"  Sorry what you are saying is one of the systematic fault in our electioneering corporate who fund a party will try to take undue advantage of party government which we are seeing with this government.
Best way is crowd funding",0.43333333333333335,0.16666666666666666,Botswana,ex-British Colony
0,The person who the NZ government has selected to chair the royal commission of inquiry into our covid response. I hope there is a fair amount of self reflection involved in that review. https//t.co/zFsVt0YiZS,0.9,0.7,Zambia,ex-British Colony
1,In the coming election year don’t forget how many useless ’liberals’ in our Parliament voted for a similar law. https//t.co/ZnVkaLrYNA via ,0.3666666666666667,0.0,Zambia,ex-British Colony
2," Sadness, sad that we have lost our can do attitude. Sad that the government controls most of our lives.",0.8333333333333334,-0.16666666666666666,Zambia,ex-British Colony
3," I mean of obviously. Of course in New Zealand the New Zealand government pays for our education, so we’re ALL nepo babies. Come live here it’s GREAT!!!",0.5577651515151515,0.18276515151515152,Zambia,ex-British Colony
0, This is a shame to our people and country. The lip service of these government and police force is an affront to our democracy.,0.0,0.0,Gambia,ex-British Colony
1,"Government must respect rights and treat people with dignity.
Gambia Police Force must realise that we clothed them with  the responsibility to protect and promote our rights not otherwise. We  gave you monopoly of instruments of violence( teargas, batons, guns ) to protect us.",0.0,0.0,Gambia,ex-British Colony
0,Our Government will be slow on this one as well. CovidIsNotOver,0.39999999999999997,-0.30000000000000004,ZAF,ex-British Colony
1," Jordan When has that ever happened? If that was the case, the mother body being in shambles wouldn't have an effect on the LFAs and Regions.
My contention is that SAFA is setup exactly like our Regions in government. They do have a level of autonomy, but they need funding from National.",0.25,0.25,ZAF,ex-British Colony
2, Baffling. And then the random ‘our government has failed us big time’ quote as if that’s somehow a new or remarkable thing to say.,0.4209090909090909,-0.022727272727272728,ZAF,ex-British Colony
3,r Thanks to our politically matured President. I think it's a farewell thing. Not coming back to government maybe.,0.10000000000000002,0.06666666666666667,ZAF,ex-British Colony
4,  Some say gov should not compete in free market to provide goods like houses as it can afford to be non-profit and therefore put businesses out of business. I think some circumstances can merit this if the free market is rampant. But I don't have that confidence in our government.,0.8,0.4,ZAF,ex-British Colony
5," Do you have any plans of our opened boarders,as citizens of this country we are suffering under your ANC government, now you tell us about winning elections, what are going to do after winning elections nothing as usual,you just want to be there, Shame on you",0.75,0.5,ZAF,ex-British Colony
6,  As a start we need to remove the ANC from government and vote a competent party into power. They will then do what is necessary to solve our energy crisis.,0.8333333333333333,0.25,ZAF,ex-British Colony
7, 2024 is a year away now! Coalition government will start to take form and by the next elections after that we will see some real change in governance for the first time in our new countries history. ANC is fractured and in a decline. The polls will be the last one laughing trust!,0.2309090909090909,0.11727272727272728,ZAF,ex-British Colony
8,"R52 Billion in wasteful spending from our government. 

Yet SARS wants to know when money get's paid into your bank account.",0.1,0.2,ZAF,ex-British Colony
9, That’s why we need to go back to a government of nation unity.  It was our best idea. And we turfed it after 5 years. That was a mistake. It should have been the cornerstone of our form of democracy.,0.15,0.5,ZAF,ex-British Colony
10,Is our government gonna respond a little too late again? https//t.co/XXB4r8oXnv,0.55,-0.24375,ZAF,ex-British Colony
11,A fitting metaphor for our government. https//t.co/jR6xVZg6t1,0.5,0.5,ZAF,ex-British Colony
12," DA is the HOPE for South Africa. However the longer people take to vote them into National Government, the less infrastructure they can save. Don't wait until EVERYTHING is destroyed. Think of what your children have to look forward to for their future in this country.",0.09583333333333333,-0.08333333333333333,ZAF,ex-British Colony
13,"McCullpugh Why are you sorry to say it.... these covid carriers don't even pay taxes here in SA and with the blessing of the government. 
I've worked with Chinese engineers with the upgrading of our cell networks. Some openly showed their dislike for Blacks.",0.5,-0.16666666666666666,ZAF,ex-British Colony
14,ad South africa will rather have lockdown for us as if it didnt see this coming end of the day ..there's PPE money and all during covid so our government wanna eat the funds they want more funds to loot gambling with our health,0.5,0.5,ZAF,ex-British Colony
15, Our country was beautiful before ANC government.,1.0,0.85,ZAF,ex-British Colony
16,"s   Uyislima Mkhawane, we don’t want restrictions, we want to be heard, we told government to close borders before patient 0 came into our shores, whatever happens after is unacceptable because we were never listened to, musa ukudakwa",0.0,0.0,ZAF,ex-British Colony
17,  I wish our South African government (ANC thugs) would do all to support you instead of sucking up to Putin. Zelenski &amp; the Ukraine people are a beacon of light out of a dark terrible 2022. I hope for your victory over tyranny soon,0.525,-0.1875,ZAF,ex-British Colony
18,And our 🇿🇦 government support Russia?  I will never understand why 💔 https//t.co/4ZlRK2HNJq,0.0,0.0,ZAF,ex-British Colony
19,   DA    The solution is to vote the ANC out of governance and hope and pray that the that we will have a new government that can implement all these policies and the country can finally have some hope going forward. That is the only solution right now. Happy new year to you.,0.7408008658008658,0.2264069264069264,ZAF,ex-British Colony
20,"So seeing news of governments imposing PVR tests on travelers from China, it has me wondering if the South African government is going to wait for the horse to blot before they do the same. Here's hoping they will be proactive this time. DA  ",0.0625,0.0,ZAF,ex-British Colony
21,"CLEARLY , HAS LOST CONTROL... WE NEED A NEW BETTER GOVERNMENT. LIKE IT OR NOT , DA IS THE ONLY OTHER BULL IN THE RING. 
 State of failure Six companies hit by government failures https//t.co/GXYfAHwdTH",0.5021464646464646,0.049116161616161606,ZAF,ex-British Colony
22," Even if that were the case, given an ethical government, we are still stuck with a SOE in the grips of syndicates. With our current unethical government, this will never be resolved due to the failure of SAPS and the ass hat.",0.41875,-0.060416666666666674,ZAF,ex-British Colony
23,  DA Gauteng Provincial Government () is in charge of Emergency Services in the Province. Failure to train &amp; provide adequate equipment to first responders led to this tragedy.,0.3222222222222222,0.08888888888888886,ZAF,ex-British Colony
24," Perhaps these unnecessary disasters are happening 2 highlight 2 the voters of this country, that they have the power 2 end their suffering by voting in a competent government like DA. If voters truly care about their lives THEY need to care enough to do something about it.",0.6888888888888888,0.033333333333333326,ZAF,ex-British Colony
25,Dooms Because the passing of more than 71 people daily by MURDER are our statistics. We have become desensitized to death by an  government who couldn't care less about maintaining Law and Order and protecting society as a whole.,0.24166666666666667,0.13333333333333336,ZAF,ex-British Colony
26,"The Romanian Government release our Muslim Brother from your custody ....
If you want war, we are opening war against you , 1, 7 billion Muslims around the world please stop buying made in Romanian products 
muslimUnited 
andrewtateisinnocent 
boycottRomania https//t.co/XXU0pYBfRe",0.0,0.0,ZAF,ex-British Colony
27,   must first negotiate with opposition leaders he got arrested today before he tells our government to negotiate with M23.,0.3333333333333333,0.25,ZAF,ex-British Colony
28,"This country under titANiC government it's going down its seems everything is collapsing.... if it's not GBV it's Phala Phala and if it's not Phala Phala it's children dying from alchohol ezimokolweni, if its not that  racist old white male trying to drown our boys in the pool https//t.co/nRloDt8r37",0.14722222222222223,-0.013888888888888895,ZAF,ex-British Colony
29, We’ve seen how quickly change can happen when people are called our publicly. Yet we don’t do it often enough when it comes to government. Let’s do this and make it trend every day if the year. 🇿🇦 has infinite potential that’s been squandered for centuries now. Enough,0.5133333333333333,0.06666666666666667,ZAF,ex-British Colony
30, This will continue as long as our government is not closing all the scrapyards,0.4,-0.05,ZAF,ex-British Colony
31,"     amBongsie    Some among us are tired of too much government in our lives, let the parents deal with this mess on their own",0.51875,0.056249999999999994,ZAF,ex-British Colony
32,cabonena With parts from China! 😂 It's doesn't matter it's about supporting local and bring back manufacturing on an economical scale back to our own country. These ppl teach their kids skills and trades not the crap the government pushes in mainstream schools.,0.42142857142857143,0.04999999999999998,ZAF,ex-British Colony
33,   No just as with everything in this country. So our complaints on twitter should not affect you guys in support of the trend of Government of helping people who do not need assistance and neglecting those that do.,0.0,0.0,ZAF,ex-British Colony
34, DA This inequality and uneven playing field repeats itself everywhere in South Africa. We have a national government that is trapping people in poverty with socialism.,0.2,-0.2,ZAF,ex-British Colony
35,We can't use the law to heal the country. Imprisoning people is never going to solve our problems. We need a Dept of Social Cohesion and a Government of National Unity (like 1994-1999).,0.06666666666666667,0.03333333333333333,ZAF,ex-British Colony
36,"   DA    Is that what the ANC government has done for the black people in SA? Destroyed their ability to generate income. Offering R350 to the unemployed masses, keeping them dependent on the the state. This is not humbling, it strips people of their dignity and their human rights",0.26666666666666666,-0.08333333333333333,ZAF,ex-British Colony
37,"Benchmark RSA bonds trade around 10.8%, implying a meaningful chance of inflationary, institutional collapse scenarios over the next decade. 

Question to ask is - how does prospect of coalition government affect our scenario analysis?

Does it accelerate or inhibit the decay?",0.25,0.25,ZAF,ex-British Colony
38," Middle-class S Africans Inequality, crime and unemployment are a huge problem the government needs to resolve.

SA govt. tries to introduce universal healthcare to reduce inequality.

Middle-class S Africans No not that way. We want to keep our exclusive services.",0.43333333333333335,0.10000000000000002,ZAF,ex-British Colony
39,  We had the same thing a few years ago in Cape Town. The Pine Trees in many of our National forests (Government owned) were cut down on mass for a few reasons. The motive was partly commercial but also conservation allowing more indigenous growth,0.23055555555555557,0.06349206349206349,ZAF,ex-British Colony
40," For as long as we remain quite to the rapid decline of our country, we are also complicit to it n when all is said n done we will remember not the actions of the corrupt government but the inaction of the people..",0.7,-0.275,ZAF,ex-British Colony
41,"2242022 Yes indeed, but as opposed to many African governments, Africa's most independent MSM does not succumb to Russian demands. In South Africa, MSM continues to oppose and condemn our government",0.225,0.2,ZAF,ex-British Colony
42,Does she want us to revive the apartheid government so they can put pencils in our hair again? 😭 https//t.co/ilWX25ELQ5,0.0,0.0,ZAF,ex-British Colony
43,"  Those roads have low IRI (International roughness index) and connot be ridden comfortably. They will mess up your shocks, cobble stone is not the answer to asphalt. Asphalt surfacing is the best option what our government need to change is using a bitumen stabilized base",0.4291666666666667,0.07083333333333335,ZAF,ex-British Colony
44, DA DA believes in ownership of the land. Every person has a right to own a land boy rent it or be expropriated by the government without compensation.,0.7678571428571428,0.44285714285714284,ZAF,ex-British Colony
45,"SA Government should impose Travel Restrictions from China, We cannot afford to go back to Lockdown and Destroy our Country further. Urgent messages.  Do it now. Like USA.",0.16666666666666666,-0.06666666666666667,ZAF,ex-British Colony
46," This is so hurtful, a country where a president piss in his pant publicly. Now is bringing his military to our door for a so called ""help"". Where are we going with these disrespect acts upon our beloved country? 
This government Must fall..",0.3888888888888889,0.19999999999999998,ZAF,ex-British Colony
47,"         DA Perhaps taking action stronger than an odd letter every now &amp; again?

Just too easy to shrug &amp; blame national.
What’s the point of having an opposition local government if they just get to do the easy stuff (for whites)?",0.4033333333333333,0.16,ZAF,ex-British Colony
48," 1) You can have sun and competent government.
2) We already had our pandemic, it killed huge numbers of people and devastated our economy. 
3) We actually get loadshedding on the daily, instead of just ominous talk of it at some point in the future.",0.2986111111111111,0.11666666666666668,ZAF,ex-British Colony
49,"  Directly from the mayor of Cape Town

“This is not a project in secessionism,” he said in an interview with The Globe and Mail.

“This is our country, this is our home, and I don’t want to break it apart. 

https//t.co/C8qWdxs8J4",0.4,0.1,ZAF,ex-British Colony
50,"    S African here, yes theres alot of government corruption, much like most governments. That doesn't give a free pass to unscrupulous western corporates to abuse our people &amp; resources. There needs to be accountability, whether it's from gov or corporations. Doing nothing is not ok",0.3333333333333333,0.1416666666666667,ZAF,ex-British Colony
51,So has every other power station majority of our infrastructure was built by the apartheid government I mean what has the anc really built or developed that was on time and in budget the anc has failed to push the country forward and failed to properly develop https//t.co/jZavgcGvKa,0.32321428571428573,-0.1625,ZAF,ex-British Colony
52, The ANC Government should have long time pay attention on our Roads and maintain our Roads . But Government only wake up once there is a incident.,0.7,-0.025,ZAF,ex-British Colony
53," U lot need to stop this 
Blame it on the UK government for forcing the sale of our club... None of this will have happened. This man we have here trying his best to serve our club 
The slander needs to end.
CFC",0.3,1.0,ZAF,ex-British Colony
54, Lack of respite to our Peoples promoted by Baiden satanic globalists government,0.0,0.0,ZAF,ex-British Colony
55, n nala  This is what we trying to change. We all need to help government improve our lives. We not gonna achieve anything if we talk ourselves down.,0.2888888888888889,-0.15555555555555559,ZAF,ex-British Colony
56,"         DA What is the point of having a DA local government if they are so scared of national govt that they do nothing?
It’s just so easy to be a party of blame but no action especially for the benefit of the poor on the periphery of the rich white city.",0.46904761904761905,0.05119047619047619,ZAF,ex-British Colony
57,bafe  cabonena So you punish innocent people now for history. While you had 30 years to make things right. Stop blaming whites for your downfall. Right our wrong. I did nothing to no one. Get over it really. 7% whites vs 80% + blacks. Overpopulation causing poverty by lawless government,0.5742857142857143,0.15428571428571428,ZAF,ex-British Colony
58, We're blacks but our government exclude lot of us!,0.0,0.0,ZAF,ex-British Colony
59,THESE WHITE FUCKERS ARE SPOILT BY OUR  BACKBONLESS GOVERNMENT https//t.co/5CWEOUlR3D,0.0,0.0,ZAF,ex-British Colony
60," matshela SA  DA  Which government entities in particular do Afriforum or the DA own? Which contracts in particular with which they ""steal"" are they parties to?",0.5555555555555555,0.31111111111111106,ZAF,ex-British Colony
61,Let's not forget that our government used to publish this statistic until it became obvious the vaccine wasn't preventing serious illness. discontinued https//t.co/8KvXv54znm,0.5833333333333333,-0.16666666666666666,ZAF,ex-British Colony
62, This is foolish. We have a black government. An entire executive and legislature made up of well-paid mostly black South Africans. We don’t need another NPO bleating from the sidelines in accordance with its funder’s interests. We need our govt to act for us. ,0.49722222222222223,-0.1111111111111111,ZAF,ex-British Colony
63,This is who South Africa (ANC) is playing geopolitical games on the side of and taking it's ideology and lead from. Now ask yourself why are you even surprised by how asinine and discombobulated (fucked up) our own Government is?😂😂😂😂👇👇👇 https//t.co/wAPFfK0o6K,0.8666666666666667,0.033333333333333326,ZAF,ex-British Colony
64,This buffles me and we the people will one day deal with this! It's Africa yet settlers want their own thing in our African soil and we make it okay!! Our government shall fall come next election https//t.co/arkcGgMkiE,0.375,0.3453125,ZAF,ex-British Colony
65," carl  This  have no loyalty just pure greed. Even Cyril is non-the-better - Instead of Promoting  , who didn't want to do business in an Apartheid government, Cyril opted to buy Coke bottling license, after our ""supposed"" liberation-Take heed white   members.",0.25,0.10714285714285714,ZAF,ex-British Colony
66," The west thinks there is a major climate issue here when the people can’t eat so they send petty cash 

https//t.co/fp9WI0YiiJ

It’s the least of our problems",0.45,-0.11875,ZAF,ex-British Colony
67,"If our politicians, policy makers and people in government actually used the public transport they provide they would understand what needs to be done. https//t.co/efkYQWrmJx",0.08333333333333334,0.0,ZAF,ex-British Colony
