,Tweets,Subjectivity,Polarity,country,region
0,"The person Sir Dele is supporting, is he not one of the looters of our treasury indicted by the US Government. The same Sir Dele that is supporting a known looter of public treasury is the one you wish to lead Nigeria? This life nor balance o. https//t.co/2JCrvgACPB",0.17291666666666666,0.125,Nigeria,ex-British Colony
1,"please where do we collect from, our local government office? https//t.co/2CafmecXsj",0.0,0.0,Nigeria,ex-British Colony
2,"Our expertise is in issues and crisis management, stakeholder communications and change management. Because we serve clients across diverse sectors i.e. energy, IT, education, health, government etc we are interested in everything that happens in business, politics and society.",0.5,0.25,Nigeria,ex-British Colony
3,Go and collect your PVC and be ready to chase out criminals from our government. https//t.co/2fC9BTPo3m,0.5,0.2,Nigeria,ex-British Colony
4,"8 more years to my life, that's if I'm still here to witness it.

Imagine giving 8 years of my life to another wrong chain of government. 

This is it for most of us because 8 years after today, there'll be no more fight left in us. Just like our parents. And ours will be worse.",0.5,-0.025000000000000005,Nigeria,ex-British Colony
5,republic no uaag disbursement no vote for apc. Help us to beg Nigeria government to disburse uaag grant that we subscribe for with our money,0.0,0.0,Nigeria,ex-British Colony
6," Borrowing to foot the budget is signing debts for us and unborn generations into law. A government that cannot harness the resources within NIGERIA is a failure. I can't feel the impact of our budgets, it's mere figures to me, it's painful 🙃",0.5666666666666668,-0.5055555555555555,Nigeria,ex-British Colony
7, pls beg Nigeria government to disburse our uaag grant that we use our hustle money to subscribe for,0.0,0.0,Nigeria,ex-British Colony
8,"Palliatives revealed our Government's wickedness, endsars was our first peaceful march against impunity, their show of force is what awakened this political revolution. They will learn next month that a colony of ants can make a lion run from his den.",0.2333333333333333,0.125,Nigeria,ex-British Colony
9,"  Stop stressing he only need attention, even blind man can see how buhari led government ruin our beloved Nigeria",0.8888888888888888,0.06666666666666665,Nigeria,ex-British Colony
10," And that's the kind of government we should endorse our votes again??.
Lies. Change is sincerely certain this year.",0.7357142857142858,0.40714285714285714,Nigeria,ex-British Colony
11,"  When local government funds were finally released, what was it used for?

You lots are always blinded by sentiments. Obasanjo remains our best president ever. By Miles the most intelligent of all",0.54,0.45999999999999996,Nigeria,ex-British Colony
12,"Are you twitter influencers mad innit ? 
Is Burna boy your country's government that has enslaved including you pooja!? 
You all just get mad when people around you take their business and brand seriously. Just because he complained &amp; pointed out clearly the incapacity of our https//t.co/UKPr6ynGCC",0.65,-0.38791666666666663,Nigeria,ex-British Colony
13,"Those who manipulate this unseen
mechanism of societv constitute an invisible government which is the true ruling power of our country. ..We are governed, our minds are molded, our tastes formed, our ideas suggested, largely by men we have never heard
of.",0.5392857142857143,0.28214285714285714,Nigeria,ex-British Colony
14, Are you people not ashamed of yourselves? This is the worst government i have ever seen in my life..you people have put too much pains in our lives with your selfish governance. You people must not go unpunished.,0.7333333333333334,-0.43333333333333335,Nigeria,ex-British Colony
15,  IpobDOS     Nigeria  Fulanis must not have an inch of our land. The Nigerian government must understand that this present generation of Biafrans cannot be intimidated by thier terrorism act in other to grab our land.,0.1875,-0.0625,Nigeria,ex-British Colony
16,Every day  we fear for our lives. Some of us were enslaved by Government &amp; Forced to kill our own families for money ...,0.6,0.14999999999999997,Nigeria,ex-British Colony
17,"citizens. How about adding incentives to water transport usage? How about investing in getting more boats with long term maintenance on our various waterways? Government tbh isn't rocket science. Lagos can afford these things but then, we ain't ready.",0.475,0.1625,Nigeria,ex-British Colony
18,"   gawat          Tosyn Lmao 🤣 but if we decide to go that way you will call our government bigotry. Make Una SHA thread carefully there is something called boundary be sincere with yourself can this happen in your hometown where a fulani man can go represent the NDI Igbo of Nbise, IMO, or AWKA?",0.8333333333333334,0.3333333333333333,Nigeria,ex-British Colony
19," Bad people voting bad government 
Bad government giving bad people police job 
Bad police killing the citizens 
Bad people turning to UGM killing people and police men
Such is life.
We b our own very problems",0.6444444444444444,-0.37777777777777766,Nigeria,ex-British Colony
20," So sad seeing and hearing bad news on my TL everyday anyways nobody's fault when senseless citizens voting bad people into the government and government giving thieves and killers as the security personnel around us
Abeg we b the real our problems.",0.6466666666666667,-0.37999999999999995,Nigeria,ex-British Colony
21, It's time Nigerian government look into our hospital sector,0.0,0.0,Nigeria,ex-British Colony
22," Lagos get ready for Emanicipation. it start by collecting your PVC; PVC Collection continues at INEC offices in our Local Government Areas LGA or your Local Community Development Area LCDA from now still 22 January, 2023. Also visit your ward for collection starting from 6/1/2023",0.15,0.05,Nigeria,ex-British Colony
23,"Women Federal government cabals are trying by all means to use the poor masses grant money to replace the trillions they stole from Nigerian government that is why the do not want to disburse the grants meant for the poor masses and 97% of Nigerian families are poor,come for our Rescue https//t.co/dtVRCoPg3x",0.6,-0.4,Nigeria,ex-British Colony
24," I hope Nigeria isn't part of those countries?
Cos our government might just name Nigeria as Pele",0.0,0.0,Nigeria,ex-British Colony
25,"Buhar Vibes I was merely economical with words. How did the guy escape arrest all the way from Brazil? How many of these drug peddlers escape at the Brazilian airports, but got arrested in Nigeria? Our government has done so much more in this regard.",0.475,0.3125,Nigeria,ex-British Colony
26,"We said we want the following;
1. Prudence in government.
2. Right-thinking person
3. Capacity
4. Competent fellow
5. Good Character
6. Human feelings
7. Progressive
As a president of our nation and God gives us Obi u are still having objection, you need oraimo cord to be wiped.",0.3666666666666667,0.3,Nigeria,ex-British Colony
27,"We the citizens, the first victim of the bad government. Our endorsement and vote for Peter Obi is much more important than anything else. We are the Obidient!",0.51,0.09500000000000001,Nigeria,ex-British Colony
28,"  UN gave Nigerian masses grant to alleviate poverty in our various families, federal government cabals are training by all means to hijack the money meant for the masses to their various account,listen to our voices all over the world and come for our rescue..",0.5,0.0,Nigeria,ex-British Colony
29,This has always been my position regarding almajiranci. But our people (their parents in particular) like blaming others for their misdeeds hence majority of them blame the ‘system’ aka government. Allah sa mu dace. https//t.co/Kj8eZHckVR,0.3333333333333333,0.16666666666666666,Nigeria,ex-British Colony
30,Do feedback really works in effective governance? If yes the level of complains in our nation on a daily’s is enough to pilot world class and seamless governance. Are the feed backs primary or secondary data? Plenty work to do as citizens to enhance government.,0.34285714285714286,0.14285714285714285,Nigeria,ex-British Colony
31, I finally got my pvc but when I got there I saw plenty pvc that hasn’t been collected please let’s go and get our pvc it’s readily available. We need to vote out bad greedy and selfish government,0.7666666666666666,-0.19999999999999996,Nigeria,ex-British Colony
32," 97% of Nigerian masses are poor,Nigerian government refuses to disburse the grants united nation gave the masses,cos federal government cabals wanted to hijacked the funds meant for the poor Nigerian masses to their private accounts as CBN governor did,Come for our rescue!!!",0.4875,-0.2,Nigeria,ex-British Colony
33," United nations gave Nigerian masses grant to alleviate poverty from our various homes,today 2nd February the Nigerian government has not disburse the funds,Nigerian government refuses to show united nation the right person signatory to the documents for disbursements!!!",0.3452380952380952,0.18601190476190474,Nigeria,ex-British Colony
34,"Women 97% of Nigerian are poor,UN gave the masses grant to alleviate poverty in our families, today 2nd January 2023,Nigerian government refuses to disburse the grant to our NGO's,Federal Government Cabals wanted to hijacked the funds meant for the poor masses to their Various accounts",0.3666666666666667,-0.13333333333333333,Nigeria,ex-British Colony
35," Please come for our rescue,97% of Nigerian masses are poor,hunger is killing some families,UN came for rescue,today 2nd December 2023 No disbursement, The federal government cabals wanted to hijack the funds for the poor masses to the private accounts As Godwin Emefiele Did..",0.325,-0.13333333333333333,Nigeria,ex-British Colony
36, Personally I don't think presidential system of government is the best for Nigeria given our diversity and our resources...why most we have bicameral legislation??,0.3666666666666667,0.5,Nigeria,ex-British Colony
37,"law But how many of our fellow citizens understand this ( Or they pretend not to). Once they hear removal of subsidy, the opposition party use that as the perfect opportunity to drag the government.",0.5236111111111111,0.4666666666666666,Nigeria,ex-British Colony
38," And our dear Lagos politicians built light rail for almost 60 billion dollars.... 

See why we need to vote Dem out next month...

Those thieves in Nigeria government will not see peace",0.35,0.2,Nigeria,ex-British Colony
39," Be honest with our efforts. Don't shortchange anyone, individuals, corporate or government. And most importantly, set up genuine businesses. A lot of our businesses go under before 5 years, not because of harsh business environment but sharp practices and fraud. It needs to stop",0.6214285714285713,0.225,Nigeria,ex-British Colony
40," Operation Feed the Nation metaphorcised into Obasanjo Farms Nigeria Limited. All these indomie generations are not likely to know this. Reason his government also removed history from our curriculum. God spares his life,he will witnessed the inauguration of BAT in May, Godwilling",0.5714285714285714,-0.03571428571428571,Nigeria,ex-British Colony
41,22betscam these guys refuse to release our money we're urging the nigeria government to ban them from our country,0.0,0.0,Nigeria,ex-British Colony
42,    Please pay us our money. This APC government is the most corrupt government in the world. U. N. Please persuade Nigeria government to pay us our money. Thanks,0.5666666666666667,0.06666666666666667,Nigeria,ex-British Colony
43," gawat           Tosyn Own airports and seaports to the international standard. Those things are in the exclusive list, which only the federal government can approve.
Nothing else is in Lagos.
Don’t worry, when  enter and all the oil companies start relocating their headquarters, when all our",0.5,0.15,Nigeria,ex-British Colony
44," gawat           Tosyn Ization, is because the federal government concentrated seaports and airports in the north and south west, thereby making it cumbersome for our people to import without coming to Lagos or Abuja, surely  will change that.
Before you remind me that we should build our",0.8888888888888888,0.5,Nigeria,ex-British Colony
45," God Abeg ooo,
Part of the consequences of the APC government and brain drain of the very best of our Doctors.",0.39,1.0,Nigeria,ex-British Colony
46,"Obi is the only hope of every common Nigerians. If we allow these thieves who have hijacked our government for many years to snatch this opportunity from us this time that we are so close on giving them mass burial throw vote for Peter Obi, we will be doomed for long time. https//t.co/LRqhvGaezQ",0.6,0.037500000000000006,Nigeria,ex-British Colony
47,"2/b Please fill the incident form on our website 
https//t.co/oRTJ7bAIRR
state the local government and the name of the inec staff attending to you. 
You can also call 0700GRVLAGOS from tomorrow to log your complaints. obidients",0.0,0.0,Nigeria,ex-British Colony
48,obj This man is one of our sour ces of poverty in Nigeria. His Government nationalised all schools in the 70's without enough resources to back up demands. He spent 8-years as civilian President with powers to repairs Nigeria's deteriorated structure.. What's he saying?????,0.175,-0.0625,Nigeria,ex-British Colony
49," Nah so our government be too

Then when you tell a kid to stop doing something you’d punish kill the young lad?",0.4,0.1,Nigeria,ex-British Colony
50, Our government that is our right to ger good governance from no send us make e be artistes. No worry urself danny. It will be fine,0.5452380952380952,0.4674603174603174,Nigeria,ex-British Colony
51," Learn new productive skills in 2023 and help eradicate hunger from our continent. The government has tried its best, the citizens should do their's to provide more food, learn how to produce fertilizer, fish and chicken feed etc
Get AGRIPRENEUR HUSTLERS @ https//t.co/P34fK60OsJ https//t.co/9qGxYXExBO",0.5511363636363635,0.25909090909090904,Nigeria,ex-British Colony
52,"Nigerians too dey collect abeg! Collect wotowoto from government, collect from employers, collect from artistes.
😭Normal, all of us suppose go heaven cos our eyes too see for this country.",0.0,0.0,Nigeria,ex-British Colony
53," Na poverty make una dey whine us Nigerians like this oo.. but e no matter,na our government make una see us finish…APC nice one! 👍",1.0,0.75,Nigeria,ex-British Colony
54," Yusuf So you know that a Nigerian living in diaspora coming back to serve under his government is a curse? You people know your principal is evil but support him for selfish gains. He will never be our President because it's not God's doing.

Keep crying!!!",0.65,-0.47265625,Nigeria,ex-British Colony
55," As long as there is a higher percentage of Nigerians who practice self-hate, this kind of practice would continue. Our Government fucks us and people still cheer them, Rich people do despicable acts and they're idolised. Na the self hate de give dem liver las las.",0.69,0.075,Nigeria,ex-British Colony
56," We need to understand that self or individual change for the better matters most in Nigeria. Aside from government even the workers and management for fueling stations corrupt.

Let's get our change positive",0.5890909090909091,0.14545454545454545,Nigeria,ex-British Colony
57,"Dear Nigerians! Go collect your PVCs from INEC Office.
With our votes we can eject bad leaders out of the government by using our PVC wisely to vote for H.E.  and Dr. through the National party 'PDP'  

As one we can get it done.
WeWantPDPBack https//t.co/tYHmc2g9ci",0.7833333333333333,5.551115123125783e-17,Nigeria,ex-British Colony
58,obj Wise words. Vote in competent and conscientious persons into government. Only individuals who can listen and take advice need our votes. Don't anyone that think themselves as god. It's a recipe for disaster,0.8555555555555555,0.39999999999999997,Nigeria,ex-British Colony
59," Respectfully, you're loosing ur senses

If our government and politicians were serving their rightful purpose you wouldn't be holding a celebrity for this account

You sef hustle and make millions, let's how you'll start to distribute and donating your money, Mr. Adviser",0.7,0.5,Nigeria,ex-British Colony
60, Needful? You know our government Naa...we won't do anything until 911.,0.0,0.0,Nigeria,ex-British Colony
61,"Traffic Small time you go see the werey go abuse government say them fail, for him department now shey him no faill, we need to our attitude as a Nigerian to make this country great again",0.48333333333333334,0.01666666666666668,Nigeria,ex-British Colony
62,"Poverty is what most people refer to as witches, solve the problem of poverty and you will see no witches again, The only witch in our lives is the Nigerian government.😆 

Sowore  On “Village people”",0.75,0.25,Nigeria,ex-British Colony
63,  Obj's government is the best in our recent history so it doesn't require argument if you're objective.,0.21666666666666667,0.3333333333333333,Nigeria,ex-British Colony
64,Why will there be an IDP camp in the capital of NIGERIA….it’s shows the level of INSECURITY in our country… has really played a nonchalant role in treating security problems which is the main priority of any government so if  can it’s better we just win!!,0.3583333333333333,0.4666666666666667,Nigeria,ex-British Colony
65,"You guys should leave Burna Boy alone and face your government that  has caused pro max damage to our economy and society. If the head is good the rest of the body will be okay. 

Burna no be your problem. Na your government.",0.55,0.6,Nigeria,ex-British Colony
66, Back This video makes believe we deserve our government,0.0,0.0,Nigeria,ex-British Colony
67,"The people of Akpa Edem, Ozzi Edem and Okutu communities in Nsukka Local Government Area of Enugu State have told Governor Ifeanyi Ugwuanyi who is the candidate of the Peoples Democratic Party (PDP) for Enugu North Senatorial District in the 2023

https//t.co/wDF7QvmIro https//t.co/BPpTzY5FFJ",0.0,0.0,Nigeria,ex-British Colony
68, If our government were to legalize gun we are  all gun,0.0,0.0,Nigeria,ex-British Colony
69,"Obasanjo led a government that wasted over $16b meant for electricity generation with no positive result.His government wasted our resources as a nation. He is not relevant even in the southwest.Yet,you are happy he endorsed Peter Obi. Loool, you are but gullible. Obi won't win",0.4742424242424242,0.14772727272727273,Nigeria,ex-British Colony
70,"bosslady E shock you!!!? 😲 we need to celebrate garri o.., wen our government changed the colour of our currency,  i didn’t react... because they haven't attempt to change the colour of our garri... na there una go se werey 😆 🤣 😂",0.0,0.0,Nigeria,ex-British Colony
71," Eti-Osa local government secretariat is withholding our PVCi went twice from 8am till der close,der refuse to attend to us",0.0,0.0,Nigeria,ex-British Colony
72,"  please I live at ajegunle, in Lagos Nigeria ajeromi ifelodun local government. We have not seen our PVC till this moment. Every time I go there they will tell me it's not available. Please do kindly help us",0.45,0.1340909090909091,Nigeria,ex-British Colony
73,"  Compared to the this and past government we have had ever since he Left. His government remains the best in our life time. Joke on u if u are taking bad on Obasanjo while using phone to type.Without Obasanjo,by now,u would be probably by only hearing about phone witout owin one",0.44333333333333336,0.010000000000000031,Nigeria,ex-British Colony
74," Even if you perform worse than the  government, I'll support you and vote for you. We can't be doing the same thing since democracy and expect different result. Inec won't count Twitter polls, comments and likes. They'll count our votes so Nigerians pls lets turn up",0.44166666666666665,-0.13333333333333333,Nigeria,ex-British Colony
75,"   I really don't understand Nigerias obsession with federal government, when the real solution to our problems are in the states and local governments. One day we will all wake up",0.16666666666666666,0.13333333333333333,Nigeria,ex-British Colony
76,"obj 4
by inducing NA through boguos payments which makes our system of government most expensive in the world despite our low IGR.
BAT isn't a perfect candidate but best among the contestants. He has impacted lives and could be able to sustain Lagos when you withheld the allocation",0.5708333333333333,0.4166666666666667,Nigeria,ex-British Colony
77,"Our working governor   the   made life unbearable for motorists, they collaborate with   and TOUTS to illegally extort Lagosians , the state government needs to make a public address to condemn their activities.",0.2833333333333333,-0.25,Nigeria,ex-British Colony
78,"    Please released our money for God seck, the money is not for government, you people get money already pls fear God,     @weyimi        ",0.0,0.0,Nigeria,ex-British Colony
79,"  Metoo 
She’s a hate preacher…one day she’ll inspire a terror attack on white people.

Our government should have deported her with radical Islamists.
Her BLM hate is just as evil.",0.7,-0.65,Nigeria,ex-British Colony
80," If it agitators them dialogue.

if it terror go gun blazing, push them to standstill. It our territory, which kind Nigeria government we get naaaaa.

2023 February 25th God please we need Peter Obi and Datti Baba Ahamd.

Gen. Musa no do this kind thing after March 1min u are out",0.9,0.6,Nigeria,ex-British Colony
81," This our government nor get shame at all,money den nor dey give citizens, the one when oyinbo come still give us, make we take whole our body, this evil men still want collect the money,see bros the devil when God drive from heaven na then bi did niaja politician",0.7,-0.4,Nigeria,ex-British Colony
82,"It's because of this reason that we continue to emphasize on rewarding loyalty. We can't continue to waste our time on those that have no an iota respect for the polity, the government and the nation's authority. The disrespectfullness is out of this world! https//t.co/H77CYocZpe",0.5,0.125,Nigeria,ex-British Colony
83,  Our government happy new year 🎊,0.7272727272727273,0.4681818181818182,Nigeria,ex-British Colony
84,"Most of our mother’s, their only fear is, their kid getting caught by d government. They’ve been observant since our infant and they’ve accepted us that way. ❤️
Most of them aren’t financially buoyant to give us comfort away from these harassment and keep us safe.",0.5,0.3,Nigeria,ex-British Colony
85, That's why we need BAT to become the president.. we can't afford to have failures like Obi and Atiku as our next president... God will shame all of u standing against APC Government,0.0,0.0,Nigeria,ex-British Colony
86, All thanks to God Almighty for saving us (the survivors) from the hardship of your government   As far as am concerned things have never been this bad before in our dear nation Nigeria.,0.6222222222222222,-0.13333333333333328,Nigeria,ex-British Colony
87, blogging What are we going to do? Our government led us into this. You can't try this in Ghana. Even in most states in Nigeria. Some companies closes before 9pm. Calabar for instance.,0.5,0.5,Nigeria,ex-British Colony
88," freke “Araba tun ra mu, o tungba re re” meaning Ghana warns his pastors of giving prophecies and dey are a close neighbors so don’t be surprised if our government go after him if he says anything. So he’ll remain silent",0.5,0.05,Nigeria,ex-British Colony
89,"This government could achieve in his regime, then glory be to God because it’s our benefit, this is the first time I’ll see Nigeria government not taking action for their benefit but for the people,
       But so sad it’s we youth that are complaining-3",0.4777777777777778,-0.05000000000000001,Nigeria,ex-British Colony
90," Perhaps if most of our politicians can be like that, Nigeria will be better for it .rather they choose to be career politicians who depends on government for their daily leaving  it is good that he has a job of her own and not career politicians with no clue about wealth creation",0.52,0.45999999999999996,Nigeria,ex-British Colony
91," A clear and unambiguous admittance of the failure of APC government. 

I'm sure you didn't think through this tweet (can u even think sef?). 

So for 8yrs, ur party collapsed health, edu, infrastructure &amp; you still av the guts to ask for our votes? Have small shame now!",0.4930555555555556,-0.0072916666666666685,Nigeria,ex-British Colony
92, You can imagine our government needs to wake up,0.0,0.0,Nigeria,ex-British Colony
93,"With the way, Nigerians travel to London ehen London will soon be added as our 37 states of Nigeria. 

All thanks to President Buhari and the APC Government who made this possible. 🙏🏿",0.6,0.1,Nigeria,ex-British Colony
94, See! Abi we should add their government names to our congratulations?,0.0,0.0,Nigeria,ex-British Colony
95,This one is crying because of tax. Our noisy neighbors are too dumb to know that government runs on taxes. You want Nigeria to be like London but yet complain about taxes. https//t.co/SnGKj0RRES,0.55,-0.2875,Nigeria,ex-British Colony
96, ...and those CEOs that partake in sharing our $2Billion from Dasuki in the last regime should be bold to return it or surrender their outfits to the government. Some are writing from such outfits built with our common fund that was stolen.,0.43333333333333335,0.008333333333333331,Nigeria,ex-British Colony
97, May God be with you! May our Nation remain united! The least the government can do is take good care of your families. Even on an holiday you out your lives at risk to ensure we are safe! GodBlessNigeria GodBeWithOurTroops,0.5,0.3416666666666666,Nigeria,ex-British Colony
