,Tweets,Subjectivity,Polarity,country,region
485,"to better the lives of our pensioners and senior citizens.

Healthcare is one of our topmost government agenda, we will do a lot to improve on the welfare of our medical practitioners.",0.25,0.25,Nigeria,ex-British Colony
486," The APC led Government kindly disburse our grant. You cannot highjack it. The poor masses subscribed for it. 
DontStealFromthePoor",0.75,0.09999999999999998,Nigeria,ex-British Colony
487,"we will spell out what our plan is after due consultation on how to pay out the arrears &amp; pension. Pensioners are senior citizens, this is the time they sud be taken care of with many social services &amp; benefits. When we get to government, we will introduce these policies",0.3138888888888889,0.1361111111111111,Nigeria,ex-British Colony
488,"Dear  and  and other influencers let's work to get rid of bad government aka APC and PDP at all levels - local, state, federal (house of reps and senates) to make work easy and less stressful for our incoming president . Pls spread the message",0.3883333333333333,-0.11166666666666662,Nigeria,ex-British Colony
489, We seat down for our local government jejely in oshodi isolo stray bullet come hit us 😭😭😭,0.14444444444444446,-0.07777777777777779,Nigeria,ex-British Colony
490,"Agege movement NNPP FLAGOFF

early to in agege local government during the flagoff to our candidate state &amp; house of rep,
 The movement is done by our great leaders Ahj  &amp; ahj Isma'il wali agege, ,
 oniwa jimkamal https//t.co/Fgl2yWSrLo",0.35000000000000003,0.3,Nigeria,ex-British Colony
491," Jokes apart. It happened close to my residence. Yesterday we have to run for our dear life, and the worst part is; they will tell you dat is the government that sent them",1.0,-1.0,Nigeria,ex-British Colony
492, One of the function of a president is the protection of lives and property. This government has failed in all ramifications. Always quick to condemn such act should it happen outside our shores but show high level of I don't care when it affects it citizens. RIP to the departed.,0.378,-0.0013333333333333363,Nigeria,ex-British Colony
493,"APC has failed. Nigerians should take their anger to the polls and sack the PDP and APC.
The government of the day is complacent and obviously aiding this inhumane acts. Nigerians pls rise up and resist these broods of vipers and evil souls within our Nations leadership.",0.58,-0.62,Nigeria,ex-British Colony
494, Na our government dem cause am why dem no make adequate preparation to stop those old one and then publish the new naira notes as simple as that,0.33625541125541125,0.14242424242424243,Nigeria,ex-British Colony
495, Please come to our aid. The Nigeria government Cabals want to hijack our UNITED AFRICA ALLIANCE GRANT you gave us. They won't allow the set man in the person of Ken Nwakanmma +2348033545722 disburse to the 50 million Nigerians who subscribed to it. We are dying pls,0.0,0.0,Nigeria,ex-British Colony
496,"   I think it is you who needs sense. You have been robbed of it by the hate ravaging your mind. The American government is embarking on infrastructure renewal, especially in the rail sector, because of its current poor state, but you choose to undermine our success in that sector.",0.48333333333333334,-0.15000000000000002,Nigeria,ex-British Colony
497," Why do we still insist..  And put all the blame on government..  All our government are not alien...  Or rent from outside...  They are our people raise the same way with same ideology.. 
To me I think our problem is inside education...  And the solution is inside too.",0.2625,0.03125,Nigeria,ex-British Colony
498,"We also say a huge thank you to all our amazing adolescents, Youth Hub coordinators, programme managers, and health practitioners and government officials, for joining us to impact the lives of adolescents in our community.",0.9,0.5000000000000001,Nigeria,ex-British Colony
499,Making a good government begin with you and me by collecting our PVC and Vote on the day of Election not just collecting and sit at home on the day of Election. https//t.co/3rKjuboW2U,0.6000000000000001,0.7,Nigeria,ex-British Colony
500,"  leader's support? You disregard our elders, rubbish our leaders and turn around to complain that they don't protect you when you get in trouble with Nigerian government. Sorry you are on a wild goose chase. Come back home and lead the fight from the front if you are serious.",0.4533333333333333,-0.18666666666666668,Nigeria,ex-British Colony
501,vote out APC. We can't afford another Government that has zero emotional intelligence towards it's people. Let's get our PVC and vote Labor party (LP).,0.65,0.0,Nigeria,ex-British Colony
502,"  By this logic, when government and employers take out “pension”, they didn’t ask for our consent. It was signed into law - but it’s for our good at the end right?",0.5678571428571428,0.4928571428571428,Nigeria,ex-British Colony
503,"...I don't wanna say anything about this our government representatives but, I just wanna implore us all to drive safe n not contest the road with the drunks/animals in human form.
 
 
 
 https//t.co/goTund29PT",0.3,0.25,Nigeria,ex-British Colony
504, This guy no normal again ........why is this so difficult for you to share code....and we dey blame our government....this government starts with us.......say bye to trenches without code...oga shift..abeg,0.825,-0.2875,Nigeria,ex-British Colony
505,"pablo778  Doctor2 Bros, u get energy to answer these pple, no contingencies exceeds 10% of contract sum and it's always the reason u cannot see contract documents of our government even u keel the contractor. Just thieves allover and plenty waiting to thief.",0.0,0.0,Nigeria,ex-British Colony
506," This is one of the page open just to derailed us from the main agenda which is,fighting to take back our dear country from the hand  of imposters called the bad government by voting Peter Obi as our next Nigeria president come  2023. This is settled already and no one can change.",0.3,-0.10666666666666665,Nigeria,ex-British Colony
507, Our government is responsible,0.55,0.2,Nigeria,ex-British Colony
508," Later we will be blaming our government ,,what we are causing there is not small",0.2,0.0625,Nigeria,ex-British Colony
509,"This is abysmal,Our government should know that As you sow, so shall you https//t.co/CbjOvJi9Qi receive happiness, peace, love, and friendship, one must BE happy, peaceful, loving, and a true friend.Whatever one puts out into the Universe will come back to them. https//t.co/CtNnS4qpEo",0.5571428571428572,0.4571428571428572,Nigeria,ex-British Colony
510," Every sphere of our national life has got a touch of ""class"" of people.
Buhari/Tinubu co owned government economy no be any body mate.",0.0,0.0,Nigeria,ex-British Colony
0,   It is our duty to prioritize investment in agriculture and to make the sector attractive for all citizens. Leaders should not instead be partisan gatekeepers to structural government programs,1.0,0.8,Uganda,ex-British Colony
1, Why should we leave you with the infrastructure now that the government is refusing to make any additional concessions and our contract is about to expire?,0.0,0.0,Uganda,ex-British Colony
2," The gap between the haves and the have nots keeps worryingly widening,  our economy is now mostly capitalist(all thanks to the 1986 cult and their ideological defeciency). The government only and for the big capitalists, abasigade mwenonye",0.45,0.175,Uganda,ex-British Colony
3, The government can do needful. If a businessman can construct a stadium 🏟 worth sh 11b wat about the our government 🤔 sincerely,0.3,0.4,Uganda,ex-British Colony
4,"    High population growth rate is good for Uganda.
It will create a huge market for our goods.
The government must develop a quality population.",0.68,0.42,Uganda,ex-British Colony
5, SportsUg Hope our government's position is clear with sports!,0.3833333333333333,0.12500000000000003,Uganda,ex-British Colony
6," My opinion ,

1. I blame our government that has failed to set rules that can guide employers and at least the lowest salary for an employee should be 350k.
2. I think politics is the main cause of all this, politicians  are using money as a weapon to govern this country.",0.3444444444444444,-0.21111111111111114,Uganda,ex-British Colony
7, Why else would they directly meddle in our elections deactivating accounts that were government leaning and giving flimsy reasons for it,0.4,0.1,Uganda,ex-British Colony
8," Death penalty laws falsely convince the public that government has taken effective measures to combat crime and homicide. In reality, such laws do nothing to protect us or our communities from the acts of dangerous criminals.",0.5733333333333334,-0.08000000000000002,Uganda,ex-British Colony
9," 2022     HRC   Death penalty laws falsely convince the public that government has taken effective measures to combat crime and homicide. In reality, such laws do nothing to protect us or our communities from the acts of dangerous criminals. ",0.5733333333333334,-0.08000000000000002,Uganda,ex-British Colony
10," How best can I build social network and social capital in a corrupt working environment and 'who's your relative here' government? It is also sad to note that people of your class hardly pay attention to our mere comments, sir",0.434375,-0.09062499999999998,Uganda,ex-British Colony
11,"This evening,I met with the families of the New Year Stampede at Freedom City. On behalf of President Museveni and Government, I express our condolences and pray that God comforts the families.President Museveni has given 5m to each family to support the burial arrangements. https//t.co/nbnvCxmTl4",0.45454545454545453,0.13636363636363635,Uganda,ex-British Colony
12," Wrong newspapers perhaps 😄😄😄

The greatest growth of wealth has been in our lifetime.

And everywhere you look from North and South America to Europe to Africa to Asia, the biggest beneficiaries of ""government distribution of wealth"" are government officials themselves.",0.95,0.25,Uganda,ex-British Colony
13,"'...our “cities” are first proclaimed, and then they can start begging the central government for money to become “operationalised”.'
👇🏾 https//t.co/8XeWZlNSBd",0.29166666666666663,0.125,Uganda,ex-British Colony
14,"NTR are charged against services provided by government and payable only when the services are availed.

Our guide to understanding all Non Tax Revenue payments could come in handy! https//t.co/gKPjWwaUhg
FfeBanno
IBuildUganda
DevelopingUgandaTogether
URATaxMchuzi",0.95,0.375,Uganda,ex-British Colony
15," What of us who lost our parents in those accidents, will the government take care of us or pay for us school fees for this year coz i had people saying on the burial that the accidents are due to poor construction of the roads. Please talk to me Canary i was left with two sisters",0.325,-0.17500000000000002,Uganda,ex-British Colony
16, You are not being patriotic those road craters are a national treasure under this government and we need to collect more taxes to increase the salaries of our MPs so please lay low.,0.4,0.25,Uganda,ex-British Colony
17,"  It’s first, up to our government. As we talk now, there is no Transfer of Skill and Technilogy Policy. There is no framework for validating and evaluating the transfers. Majority of us thinks transfer of technology is about physical machines. We can’t even report on them",0.23809523809523808,0.125,Uganda,ex-British Colony
18, Our biggest challenge in Arbitrary states like Uganda in regards to ideology is we can not differentiate btn Party and National ideology. The same ideology taught to NRM cadres are taught to the UPDF soldiers in training. This has fused the state &amp; government with no difference,0.3625,-0.05,Uganda,ex-British Colony
19, Copied Government should investigate the matter and provide a detailed report on the death of our people. We are not sure whether all the operating procedures were followed in organising this fatal event.,0.8194444444444444,0.07500000000000001,Uganda,ex-British Colony
20,"   Morning and Happy new year  looking forward to better roads ,Equipped hospitals,less corruption and job opportunities created but we can only be optimistic cause our government talks more collects more less action",0.5151515151515151,0.29621212121212126,Uganda,ex-British Colony
21,"  Ugandans  
1.The earlier we realize that we have a failed government, the better for our mental health ⚠️ It will help us to make the right decisions to save this country 👌
2. A certain govt supporter can’t really understand how we blame government for this ⚠️",0.4010204081632653,0.08571428571428572,Uganda,ex-British Colony
22, But I heard that Uganda is about to harvest her fuel and on contrary the government is busy embarking on electric vessels. Who then will consume our fuel?,0.3,0.1,Uganda,ex-British Colony
23," And we did our stunt on 30th at Nsambya to account for our grants received both from government and misinformed donors. 

Safely indeed",0.5,0.5,Uganda,ex-British Colony
24,"kElla   I hate this government but you're right on this. I don't rate our opposition,  they are after the bag too",0.7178571428571429,-0.2571428571428572,Uganda,ex-British Colony
25,Government  help the US we nolong need losses  of people security  were are you those are our people please ........ https//t.co/wG3NRWlJfL,0.0,0.0,Uganda,ex-British Colony
26," is talking about Ukraine and his own government is funding to kill our innocent civilians.
   are responsible to SSCGENOCIDE, Somaliland military are shooting our people in Laacaanood one by one.",0.5875,0.3,Uganda,ex-British Colony
27,"Prominent faces were secretly recorded selling one of the islands after ""Investor"" promised them 5M USD. One of our Great lawyers here suggested a CSR model fused with the investment plan which government will never question.",0.8166666666666668,0.3,Uganda,ex-British Colony
28, You should as well think of our coffee which is being invaded by the government. Otherwise happy birthday may you enjoy your new age and live longer.,0.6136363636363636,0.36818181818181817,Uganda,ex-British Colony
29," Rt. Hon. Robinah Nabbanja in my opinion has done her part in dispensing services to the very down trodden. 
I wish our government had 100 like Robinah Nabbanjas, we would have been a darling nation..",0.3755555555555556,-0.20222222222222228,Uganda,ex-British Colony
30," We know very well that our government does not have the capacity to reduce the road accidents, a government which can not pay employees, a govt that can not feed its people, a gvt  that can not pay med officers, we should not demand anything from the government.",0.3,0.2,Uganda,ex-British Colony
31," At this moment I would not recommend any one to curse the government or demand anything from them, we are truly on our own and there is no government in uganda, we only have clowns. A government which does not have money to pay its teachers is setting fees. Uganda olemwa,,,",1.0,0.3,Uganda,ex-British Colony
32,"  Stop this nonsense of making stunts to look relevant trading our youths lives to earn your donations both from government and foreign misinformed groups. 

You are manipulaters nothing else. Do you share your donations with those youths that keep battling with police of course NO",0.5125,0.1375,Uganda,ex-British Colony
33,"  We've been praying all our entire lives, religious leaders now even fear to tell the ruling government that they're brutalizing unarmed citizens coz they may close their houses of worship",0.4375,0.0,Uganda,ex-British Colony
34, That's our government,0.0,0.0,Uganda,ex-British Colony
35,He we retired from the service of the government of Uganda with a clean slate back to our humble community of Entebbe. His career span 30 plus years of hard work and dedication. I actually do not remember him ever taking leave apart from when he was bed ridden.,0.34833333333333333,-0.025,Uganda,ex-British Colony
36,I call on us not to clog what's left of the drainage with rubbish &amp; plastic waste as a people this should be applied by us in all our neighbourhoods. Drainage improves health of the roads &amp; frees scarce resources for government to work on other critical sectors. https//t.co/AWsjWdT2Qm,0.29375,-0.08125,Uganda,ex-British Colony
37," Those incharge of our government have military interests In the DRC,",0.1,-0.1,Uganda,ex-British Colony
38," My best politicians have been the Nup members of Parliament, they have exposed the wrongdoing of our ruling government and corruption in this country.
Kind regards and happy 2023",0.7333333333333334,0.8000000000000002,Uganda,ex-British Colony
39,"Very unfortunate news. I call for strict road traffic rules to change behaviour of motorists on our roads. The Government should intervene with an iron hand. Remember, over 90% of traffic crashes are caused by the drivers. https//t.co/luBITKJiiN",1.0,-0.65,Uganda,ex-British Colony
40,"SportsUg        Ug Sometimes I concur with , that leaders of our government are in the back of beyond detached from the reality in this country 🇺🇬!",0.0,0.0,Uganda,ex-British Colony
41,"My prayers is that government adopts this structure. Those who can’t afford private schools we can take our children to government schools.
SportsUg ,  https//t.co/zH6cBSGCzx",0.375,0.0,Uganda,ex-British Colony
42," Politician  , come and see this doctor deceiving. Wamma aren’t our health facilities well equipped? The only problem on this day was that our government officials and their families had overwhelmed them hence creating shortage",1.0,0.0,Uganda,ex-British Colony
43," May we as a nation be forgiven and not held to account for all this innocent blood. A country whose young people are burried everyday due to avoidable deaths. The endemic corruption, lackluster attitude of our government, all these things are killing us as a nation.",0.51875,0.06874999999999999,Uganda,ex-British Colony
44,3. We congratulate the government and our gallant health workers for their sacrifice to contain the deadly pandemic.,0.4,-0.2,Uganda,ex-British Colony
45,This poll 😂😂😂. We have no faith in our government. https//t.co/TTatuUe6yk,0.0,0.0,Uganda,ex-British Colony
46,"  Stop playing funny games.....we all know the effect of political rallies in the name of ""prayer"" .....we know the state of our government...stop trying so much to prove to us ts stability....",0.43333333333333335,0.15,Uganda,ex-British Colony
47,"State of Kabibi Primary School, a government school in Isingiro that started in early 1990s. Thanks     Ug  for supporting the local community in our drive to fundraise for the school, over 20m was raised in pledges &amp; cash. https//t.co/UIy5C7CJPU",0.25,0.19,Uganda,ex-British Colony
48,"But when will our government think inline with our economy, why do they want to prove that they are doing something yet they are not.  please improve the quality and standard of your schools,  elevete them and give them the capacity to compete with private schools. https//t.co/RVEFLTh0DT",0.1875,0.0,Uganda,ex-British Colony
49,"It's in Uganda where the government also what's to head our families.
They can even kill you if you're a barrier    https//t.co/9K6vIUS8Pi",0.0,0.0,Uganda,ex-British Colony
50, Government blames opposition in Uganda it's engrained in our DNA to blame everything and anything....hindrance to success. Happy New Year!,0.48484848484848486,0.4234848484848485,Uganda,ex-British Colony
51,      You see! You are a living testimony. How do we redeem ourselves? We are being segregated by the regime in government and even within our opposition political parties.,0.1,0.0,Uganda,ex-British Colony
52,"Ashame to our GOVERNMENT that wants to collect Tax from the entertainment Sector. Do they know the hardships to reach where we are. They never funded us but you want money. High Taxes on the djs equipments. YOU CAN'T GET MILK FROM A COW YOU DON'T FEED.

Shame on you  https//t.co/nsWby6uZi3",0.26888888888888884,0.07555555555555556,Uganda,ex-British Colony
53,Please government styleup this our country no other home .why stop people from having freedom of worship?   . https//t.co/3E7T2Nko2C,0.375,0.0625,Uganda,ex-British Colony
54,  Why is Teju not working yet the government put alot of money in it ands our farmers put in alot but they are not gaining from their sweat,0.0,0.0,Uganda,ex-British Colony
55,"256 Government dictates what business  Parliament handles. In events where Government doesn't bring business to the house inform of bills then Parliament is constrained. Our current system whereas it supports Private members bills on paper, the same are hard to process  in the house",0.36041666666666666,-0.07291666666666667,Uganda,ex-British Colony
56,  Ug     Namutyab  dombo bwetukugamba nga ogamba we pretend to be perfect but this insecurity has reached its maximum. The government is out of control... day light law breaking allegedly by those who are paid to protect citizens. Day light injustice...lost trust in our own🤔,0.625,0.42499999999999993,Uganda,ex-British Colony
57," The way our family ate, wanted to call the government to intervene 🤦🏾‍♀️🤦🏾‍♀️ smh",0.0,0.0,Uganda,ex-British Colony
58,   But still having a large tax base with small taxable income will increase cost of tax administration and in the end taxation yields no revenues. How about if our government looks at other financing ventures than only relying on tax?,0.6407142857142858,-0.19214285714285714,Uganda,ex-British Colony
59,  Blame the presidentofUganda for his denial of the minimim wage...atleast it cld have enabled some Ugandans to invest....now u find an engineer earning 800k when will he be empowered!!..... is not for us...so let's wait till our government comes...,0.0,0.0,Uganda,ex-British Colony
60," I have spoted some company vehicles here. Great lakes safaris, churchill safaris, speke holidays, classic. We hope 2023 will be more than this if our government put tourism on the front page.",0.47222222222222215,0.48888888888888893,Uganda,ex-British Colony
61,"Do we have a social media policy for government agencies? Imagine, you have to be approved to follow Gender ministry UG official handle &amp; their TL is protected. We sadly have very many blockheads in public offices who are paid with our taxes😏 https//t.co/nH9eyb1tXL",0.44583333333333336,0.04583333333333334,Uganda,ex-British Colony
62," The filth of our government systems. If such a place, a national pride looks like an ancient asian shrine,with decades of decay, shows you how the GDP nonsense is just made up. Owners can't even renovate the place. It's a pity",0.2333333333333333,-0.03333333333333333,Uganda,ex-British Colony
63," And you this the Government you work for doesn't know these facts? The question you should be asking is, with all the exposure your seniors have had before you, why don't we put in place such infrastructure given our endowments?",0.5,0.0,Uganda,ex-British Colony
64," Are these prayers or political rally!? don't get surprised if our unashamed, unsecure government teargas these prayers! 😄😂",0.6333333333333333,-0.17500000000000002,Uganda,ex-British Colony
65,"ug But in an earlier tweet, you said they were under Local Government. Now it’s shifted to Ministry of Gender, Labor and Social Development? Kindly clarify. Who funds them? To whose office do we carry placards in demonstration over the awful conditions of our libraries? 🤭 https//t.co/99yeJzP1YC",0.49333333333333335,-0.07333333333333333,Uganda,ex-British Colony
66,"Government sets fees cap for schools as new term begins next year. Read all the details in today's New Vision. Get yourself a copy from your nearest vendor or subscribe to our EPAPER 👉🏽 https//t.co/Y11KonV2Tr  
VisionUpdates https//t.co/1gUpvwqMP1",0.30303030303030304,0.0909090909090909,Uganda,ex-British Colony
67," CG  UG       It really amazes me dt a government dt desperately nids money had never thought of entertainment n sports as an avenue 2 mint money. Ugandans r too talented, if only u intentionally place d right structures in diz areas I blv dey wuld almost finance more than half our budget.",0.6146258503401362,0.13129251700680272,Uganda,ex-British Colony
68," If a guy like this asks for 500K and people pay it with one heart, do you think our country should have any hope for some sort of redemption? FFS how can we blame the government for looting when we still have many Ugandans following this BS?",0.3,0.25,Uganda,ex-British Colony
69," after frustrating the creative industry for ages, our tax body and government wake up and decide to milk the cow that has been abused and rejected. Music has been discontinued in schools. The arts have been defunded. Clueless leadership we have!!",0.6888888888888888,-0.036111111111111115,Uganda,ex-British Colony
70,"dombo Mr Dombo, stop your lamentations!! All the loans that your government has acquired from everywhere can't do much, why are you crying? Those are crocodile tears!  When we talk about your failure(government)  you claim that we don't support you! So,do u want us to sell our panties?",0.4,-0.056249999999999994,Uganda,ex-British Colony
71,"This was our first ramp construction in the Nsagi village,and today alot of kids and youth benefits from the skatepark,thats why we say that we are a non government organisation using skateboarding as a tool to engage with maginalized children and their communities.. https//t.co/FsEz3RxRjK",0.3333333333333333,0.25,Uganda,ex-British Colony
72,"jo The problem is we think government loans are like individual loans. For as long as our debt to GDP ration is low, oil money is around the corner, Uganda can borrow like crazy.",0.5,-0.1625,Uganda,ex-British Colony
